{
  "$schema": "./level.schema.json",
  "id": "two-lines",
  "name": "Two Lines",
  "map": [
    "##############################",
    "#c.......#.................c.#",
    "#..B.....#......b............#",
    "#............................#",
    "#........#..H>>>>>>>>>>>>>G..#",
    "X........#...................#",
    "X..P.....#.......BB..........#",
    "X........#..................L#",
    "#..b.....#..H>>>>>>>>>>>>>G..#",
    "#............................#",
    "#..B.....#......b.....M......#",
    "#c.......#.................c.#",
    "##############################"
  ],
  "guards": [
    [[11, 6], [27, 6]],
    [[28, 2], [28, 10]]
  ],
  "rules": {
    "parSeconds": 140,
    "totalChicks": 16,
    "chicksToSave": 8,
    "maxLost": 8,
    "beltSpeed": 0.5,
    "spawnInterval": { "start": 3.6, "end": 2.6 }
  }
}
