{
  "$schema": "./level.schema.json",
  "id": "packing-yard",
  "name": "Packing Yard",
  "map": [
    "######################################",
    "#................H...................#",
    "#.H>>>>>>>>v.....v........v<<<<<<<<H.#",
    "#..........v.....v........v..........#",
    "#..b.......v.....v........v.....b....#",
    "#...G<<<<<<S.....v........S>>>>>G....#",
    "#..........v.....v........v..........#",
    "#..M.......v.....v........v.......M..#",
    "#..........F.....v........F..........#",
    "#....BB..........v.........BB........#",
    "#................G...................#",
    "#......b.....................b......L#",
    "#####.##########################.#####",
    "#....................................#",
    "#..B.....b................b......B...#",
    "#....................................#",
    "#..B......BB..........BB.........B...#",
    "#.................P..................#",
    "#c..................................c#",
    "#################XXX##################"
  ],
  "guards": [
    [[3, 13], [34, 13]],
    [[34, 17], [3, 17]],
    [[13, 3], [13, 10], [22, 10], [22, 3]],
    [[2, 11], [30, 11]]
  ],
  "rules": {
    "parSeconds": 210,
    "totalChicks": 32,
    "chicksToSave": 16,
    "maxLost": 12,
    "beltSpeed": 0.6,
    "spawnInterval": { "start": 2.8, "end": 1.8 }
  }
}
