{
  "$schema": "./level.schema.json",
  "id": "sorting-floor",
  "name": "Sorting Floor",
  "map": [
    "####################################",
    "#c........#c..........B..........c.#",
    "#..B......#.H>>>>>>>>>S>>>>>>>>F...#",
    "#..B......#...........v............#",
    "#.............b.......v.....M......#",
    "#....b....#...........G............#",
    "#.........#........................#",
    "X.........#.....H>>>>>S>>>>>>>>F..L#",
    "X..P......#...........v............#",
    "X.........#....BB.....G......b.....#",
    "#....b....#........................#",
    "#..B......#...........G............#",
    "#.............b.......^.....M......#",
    "#..B......#...........^............#",
    "#.........#.H>>>>>>>>>S>>>>>>>>F...#",
    "#c........#c......................c#",
    "####################################"
  ],
  "guards": [
    [[8, 2], [8, 14]],
    [[12, 6], [33, 6]],
    [[33, 10], [12, 10]],
    [[24, 3], [33, 3], [33, 13], [24, 13]]
  ],
  "rules": {
    "parSeconds": 180,
    "totalChicks": 30,
    "chicksToSave": 14,
    "maxLost": 12,
    "beltSpeed": 0.6,
    "spawnInterval": { "start": 3, "end": 1.8 }
  }
}
