{
  "$schema": "./level.schema.json",
  "id": "processing-hall",
  "name": "Processing Hall",
  "map": [
    "##################################",
    "#c.........#........b..........c.#",
    "#..B.......#..H>>>>>>>>>>>>>>G.R.#",
    "#..B.............................#",
    "#......b...#....BB......M.......L#",
    "X..........#.....................#",
    "X..P.......#..H>>>>>>>>>>>>>>G.R.#",
    "X..........#.....................#",
    "#......b...#....BB......M....b...#",
    "#..B.............................#",
    "#..B.......#..H>>>>>>>>>>>>>>G.R.#",
    "#c.........#........b..........c.#",
    "##################################"
  ],
  "guards": [
    [[9, 2], [9, 10]],
    [[14, 5], [30, 5]],
    [[30, 9], [14, 9]]
  ],
  "rules": {
    "parSeconds": 150,
    "totalChicks": 24,
    "chicksToSave": 12,
    "maxLost": 10,
    "beltSpeed": 0.55,
    "spawnInterval": { "start": 3.2, "end": 2 }
  }
}
