{
  "$schema": "./level.schema.json",
  "id": "first-shift",
  "name": "First Shift",
  "map": [
    "##########################",
    "#c.......#..............c#",
    "#..B.....#.....b.........#",
    "#.................M......#",
    "X........#...............#",
    "X..P.....#..H>>>>>>>>>>G.#",
    "X........#...............#",
    "#...................b...L#",
    "#..B.....#.......M.......#",
    "#c.......#..............c#",
    "##########################"
  ],
  "guards": [
    [[12, 2], [23, 2]]
  ],
  "rules": {
    "parSeconds": 120,
    "totalChicks": 10,
    "chicksToSave": 5,
    "maxLost": 6,
    "beltSpeed": 0.45,
    "spawnInterval": { "start": 4, "end": 3.2 }
  }
}
